{
  "schemaVersion": "1.0",
  "artifactType": "completion-passport",
  "taskId": "MC-077",
  "taskDigest": "75ddcb60d3c9a2dbcab1aebde9582b01706705eeed326e6e5363fdf1ac114a0c",
  "status": "current",
  "verification": {
    "result": "pass",
    "evidenceRefs": [
      "MissionCenter/smoke-tests.md",
      "docs/releases/0.5.2.md",
      "RELEASE_CHECKLIST.md",
      "output/mission-center-reports/mc-078-v052-final-release-20260913.json"
    ]
  },
  "findings": []
}
