{
  "schemaVersion": "1.0",
  "artifactType": "completion-passport",
  "taskId": "MC-074",
  "taskDigest": "810694d1ffb0e4a1c076de82ecbbab97808b71ac1d4da620810bb5ed6d902f3c",
  "status": "current",
  "verification": {
    "result": "pass",
    "evidenceRefs": [
      "docs/upgrade-0.5.2.md",
      "rust/mission-center-policy/tests/context_findings.rs",
      "output/mission-center-reports/mc-078-v052-final-release-20260913.json"
    ]
  },
  "findings": []
}
